"METADATA_COLNAME","METADATA_COLNAME_LONG","METADATA_UNITS","METADATA_DATATYPE","METADATA_COLNAME_DESC"
"AGENCY_ACRONYM","Acronym of listed Agency","text abbreviated","VARCHAR2(255 BYTE)","Abbreviated agencies that are affiliated with the Alaska bottom trawl survey. The column agency_acronym is associated with the agency_short and agency_long columns."
"AGENCY_JOIN","Agency ID","ID key code","NUMBER(38,0)","Affiliated agency ID key code."
"AGENCY_LONG","Official name of agency","text","VARCHAR2(255 BYTE)","Full official name of affiliated agencies to the Alaska bottom trawl survey. The column agency_long is associated with the agency_acronym and agency_short columns."
"AGENCY_SHORT","Agency shorthand name","text","VARCHAR2(255 BYTE)","A sort version of the full official name of affiliated agencies to the Alaska bottom trawl survey. The column agency_short is associated with the agency_acronym and agency_long columns."
"AREA_ID","Area ID","ID key code","NUMBER(38,0)","Area ID key code for each statistical area used to produce production estimates (e.g., biomass, population, age comps, length comps). Each area ID is unique within each survey."
"AREA_KM2","Area (km2)","kilometers squared","NUMBER(38,3)","Area in square kilometers."
"AREA_NAME","Area ID name","text","VARCHAR2(4000 BYTE)","Descriptive name of each AREA_ID. These names often identify the region, depth ranges, or other regional information for the area ID."
"AREA_SWEPT_KM2","Area swept (km)","kilometers","NUMBER(38,6)","The area the net covered while the net was fishing (kilometers squared), defined as the distance fished times the net width."
"AREA_TYPE","Area ID type description","category","VARCHAR2(255 BYTE)","The type of stratum that AREA_ID represents. Types include: STRATUM (the smallest building-block unit of area in these surveys), REGION, DEPTH, SUBAREA, INPFC BY DEPTH, INPFC, SUBAREA BY DEPTH, REGULATORY AREA, NMFS STATISTICAL AREA."
"BIOMASS_MT","Estimated biomass","numeric","NUMBER(38,6)","The estimated total biomass."
"BIOMASS_VAR","Estimated biomass variance","numeric","NUMBER(38,6)","The estimated variance associated with the total biomass."
"BOTTOM_TEMPERATURE_C","Bottom temperature (degrees Celsius)","degrees Celsius","NUMBER(38,1)","Bottom temperature (tenths of a degree Celsius); NA indicates removed or missing values."
"BOTTOM_TYPE","Seafloor bottom type code","ID key code","NUMBER(38,0)","Bottom type on sea floor at haul location. For a complete list of bottom type ID key codes, review the [code books](https://www.fisheries.noaa.gov/resource/document/groundfish-survey-species-code-manual-and-data-codes-manual)."
"CATCHJOIN","Catch observation ID","ID key code","NUMBER(38,0)","Unique integer ID assigned to each survey, vessel, year, and catch observation combination."
"CLASS_TAXON","Class phylogenetic rank","category","VARCHAR2(255 BYTE)","Phylogenetic latin rank of class of a given species."
"CLASSIFICATION","Taxonomic classification rank group","category","VARCHAR2(255 BYTE)","Phylogenetic classification group rank for a given species."
"COLLECTED_BY","Person who collected specimen","text","VARCHAR2(255 BYTE)","Initials of person who collected specimen in the field"
"COMMENTS","Comments","text","VARCHAR2(4000 BYTE)","Comments regarding row observation."
"COMMON_NAME","Taxon common name","text","VARCHAR2(255 BYTE)","The common name of the marine organism associated with the scientific_name and species_code columns. For a complete species list, review the [code books](https://www.fisheries.noaa.gov/resource/document/groundfish-survey-species-code-manual-and-data-codes-manual)."
"COUNT","Taxon count","count, whole number resolution","NUMBER(38,0)","Total whole number of individuals caught in haul or samples collected."
"COUNTRY_ID","Country code","ID key code","NUMBER(38,0)","Country ID key code of where a vessel, for example, may be from. For a complete list of country ID key codes, review the [code books](https://www.fisheries.noaa.gov/resource/document/groundfish-survey-species-code-manual-and-data-codes-manual)."
"CPUE_KGHA","Weight CPUE (kg/ha)","kilograms per hectare","NUMBER(38,6)","Catch weight (kilograms) per unit effort (area swept by the net, units hectares)."
"CPUE_KGKM2","Weight CPUE (kg/km2)","kilograms per kilometers squared","NUMBER(38,6)","Catch weight (kilograms) per unit effort (area swept by the net, units square kilometers)."
"CPUE_KGKM2_MEAN","Mean weight CPUE","kilograms per kilometers squared","NUMBER(38,6)","The mean catch weight (kilograms) per unit effort (area swept by the net, units squared kilometers)."
"CPUE_KGKM2_VAR","Variance of the mean weight CPUE","kilograms per kilometers squared","NUMBER(38,6)","The variance of mean catch weight (kilograms) per unit effort (area swept by the net, units squared kilometers)."
"CPUE_NOHA","Number CPUE (no/ha)","count per hectare","NUMBER(38,6)","Numerical catch per unit effort (area swept by the net, units hectares)."
"CPUE_NOKM2","Number CPUE (no/km2)","count per kilometers squared","NUMBER(38,6)","Numerical catch per unit effort (area swept by the net, units square kilometers)."
"CPUE_NOKM2_MEAN","Mean numeric CPUE","count per kilometers squared","NUMBER(38,6)","The mean of numerical catch per unit effort (area swept by the net, units square kilometers)."
"CPUE_NOKM2_VAR","Variance of the mean numeric CPUE","count per kilometers squared","NUMBER(38,6)","The variance of mean numerical catch per unit effort (area swept by the net, units square kilometers)."
"CRS","Coordinate reference system","ID key code","VARCHAR2(255 BYTE)","The coordinate reference system (CRS) that shapefiles were created in or areas (like AREA_KM2) are calculated in, as defined by https://spatialreference.org/ (e.g., ""+proj=longlat"", ""EPSG:3338"")."
"CRUISE","Cruise Name","ID key code","NUMBER(38,0)","This is a six-digit integer identifying the cruise number of the form: YYYY99 (where YYYY = year of the cruise; 99 = 2-digit number and is sequential; 01 denotes the first cruise that vessel made in this year, 02 is the second, etc.)."
"CRUISEJOIN","Cruise ID","ID key code","NUMBER(38,0)","Unique integer ID assigned to each survey, vessel, and year combination."
"DATABASE","Database source","category","VARCHAR2(255 BYTE)","Taxonomic database source, either ITIS or WoRMS."
"DATABASE_ID","Species ID in database","ID key code","VARCHAR2(255 BYTE)","Species ID key code of a species in the taxonomic ""DATABASE"" source."
"DATE","Date","YYYY-MM-DD","DATE","The date (YYYY-MM-DD) of the event (e.g., cruise)."
"DATE_END","End date","YYYY-MM-DD","DATE","The date (YYYY-MM-DD) of the end of the event (e.g., cruise)."
